{
  "spec_version": "1.0.0",
  "fixture_id": "02-feature-implementation",
  "workload_id": "02-feature-implementation.md",
  "legacy_expected": [
    {
      "node_or_event": "plan_bundle",
      "expressible_in_overlay": true
    },
    {
      "node_or_event": "task_scheduler",
      "expressible_in_overlay": true
    },
    {
      "node_or_event": "write_tdd",
      "expressible_in_overlay": true
    },
    {
      "node_or_event": "implement",
      "expressible_in_overlay": true
    },
    {
      "node_or_event": "verify",
      "expressible_in_overlay": true
    },
    {
      "node_or_event": "commit_task",
      "expressible_in_overlay": true
    },
    {
      "node_or_event": "bundle_verify",
      "expressible_in_overlay": true
    },
    {
      "node_or_event": "final_review",
      "expressible_in_overlay": true
    },
    {
      "node_or_event": "documentation_review",
      "expressible_in_overlay": true
    },
    {
      "node_or_event": "create_pr",
      "expressible_in_overlay": true
    },
    {
      "node_or_event": "bundle_scheduler",
      "expressible_in_overlay": false
    },
    {
      "node_or_event": "PLAN_DONE",
      "expressible_in_overlay": true
    },
    {
      "node_or_event": "TDD_DONE",
      "expressible_in_overlay": false
    },
    {
      "node_or_event": "IMPLEMENT_DONE",
      "expressible_in_overlay": false
    },
    {
      "node_or_event": "VERIFY_DONE",
      "expressible_in_overlay": true
    },
    {
      "node_or_event": "TASK_COMMITTED",
      "expressible_in_overlay": false
    },
    {
      "node_or_event": "BUNDLE_TASKS_COMPLETE",
      "expressible_in_overlay": false
    },
    {
      "node_or_event": "BUNDLE_VERIFY_PASSED",
      "expressible_in_overlay": true
    },
    {
      "node_or_event": "REVIEW_APPROVED",
      "expressible_in_overlay": true
    },
    {
      "node_or_event": "DOC_REVIEW_DONE",
      "expressible_in_overlay": true
    },
    {
      "node_or_event": "PR_CREATED",
      "expressible_in_overlay": true
    },
    {
      "node_or_event": "BRANCH_READY",
      "expressible_in_overlay": true
    }
  ],
  "praxis_script": {
    "write_tdd": {
      "event_type": "complete",
      "evidence": null
    },
    "implement": {
      "event_type": "complete",
      "evidence": null
    },
    "verify": {
      "event_type": "complete",
      "evidence": null
    },
    "commit_task": {
      "event_type": "complete",
      "evidence": [
        {
          "spec_version": "1.0.0",
          "proof_id": "02-feature-implementation-development.test-pass",
          "run_id": "02-feature-implementation-fixture-run",
          "graph_version": "1.0.0",
          "node_id": "commit_task",
          "proof_type": "development.test-pass",
          "executor_id": "benchmark-fixture-harness",
          "grader_kind": "deterministic",
          "status": "pass"
        },
        {
          "spec_version": "1.0.0",
          "proof_id": "02-feature-implementation-development.review-approved",
          "run_id": "02-feature-implementation-fixture-run",
          "graph_version": "1.0.0",
          "node_id": "commit_task",
          "proof_type": "development.review-approved",
          "executor_id": "benchmark-fixture-harness",
          "grader_kind": "deterministic",
          "status": "pass"
        }
      ]
    }
  },
  "expected_terminal_status": "terminal_success"
}
